Quote,Mood,Tags,Feel
Vitamin sea,Happy,"Beach, Sea, Vacation",Positive
Life is better when you are laughing,Happy,"Smile, laugh, Happy, friends, love",Positive
Not an average day off,Happy,"Vacation, Holiday, Travel",Positive
"Life goes on, with or without you.",Sad,"Love, relationship, couple",Neutral
Exhale the bullshit.,Happy,"greenery, travel",Positive
Rolling with the homies.,Happy,"friends, people, fun",Positive
The most important thing is to enjoy your life – to be happy – it’s all that matters.,Happy,"travel, work, scenary",Positive
50% Savage. 50% Sweetness.,Neutral,"Selfie, person, badass, cute",Neutral
Watch more sunsets than Netflix.,Happy,"Calm, sunset, view, mountains",Positive
"Love can be unselfish, in the sense of being benevolent and generous, without being selfless.",,,Positive
"When I feel a little down, I put on my favourite high heels and dance",,,Positive
Pretty please with a cherrry on top,,,Positive
I decide the vibe.,,,
I woke up like this.,,,
No one is you. That’s your power!,,,
Sometimes life can surprise you with a happy coincidence.,,,
Maybe, life is all about twirling under one of those midnight skies!,Happy,"Moutains,Trekking,Cute",Positive
We all need a little bling every once in a while,Happy,"Beach,cute,Bikini,Vacation",Positive
Everything you have ever wanted is on the other side of fear,Fear,"Trekking,Flight,Computers",Neutral
"A computer once beat me at chess,but it was no match for me at kick boxing!",Surprised,"Computers",Neutral
Real eyes realize real lies,Sad,,Negative